QuestionNum,Question,Answer,exp,subjectId,date
1,What is your age?,23,MEM,MEM_0059,2022-12-08 21:50:13
2,What is your sex?,Female,MEM,MEM_0059,2022-12-08 21:50:13
3,What is your race/ethnicity?,White,MEM,MEM_0059,2022-12-08 21:50:13
4,"What is the highest degree or level of school that you have completed? (If you are currently enrolled in school, please indicate the highest degree you have received) ",High school degree or equivalent (e.g. GED),MEM,MEM_0059,2022-12-08 21:50:13
5,What is your household income?,"$50,000 to $74,999",MEM,MEM_0059,2022-12-08 21:50:13
6,Which hand did you use to make your response?,Both hands,MEM,MEM_0059,2022-12-08 21:50:13
7,Feedback,,MEM,MEM_0059,2022-12-08 21:50:13
