QuestionNum,Question,Answer,exp,subjectId,date
1,What is your age?,38,MEM,MEM_0020,2022-12-08 04:09:25
2,What is your sex?,Female,MEM,MEM_0020,2022-12-08 04:09:25
3,What is your race/ethnicity?,White,MEM,MEM_0020,2022-12-08 04:09:25
4,"What is the highest degree or level of school that you have completed? (If you are currently enrolled in school, please indicate the highest degree you have received) ",Master's Degree ,MEM,MEM_0020,2022-12-08 04:09:25
5,What is your household income?,"$50,000 to $74,999",MEM,MEM_0020,2022-12-08 04:09:25
6,Which hand did you use to make your response?,Right,MEM,MEM_0020,2022-12-08 04:09:25
7,Feedback,nice study,MEM,MEM_0020,2022-12-08 04:09:25
